img|name|price|vat|ammount|height|width|depth|weight|describe|cat
https://images.obi.pl/product/PL/836x732/512913_1.jpg|Bayersystem Drabina wielofunkcyjna TG-DW 3 x 7 szczebli|398.0|1|84|190.7|47.0|16.0|10.7|"Drabina wielofunkcyjna TG-DW 3 x 7 szczebli marki Bayersystem wyróżnia się wielością zastosowań. Jest wykonana z lekkiego, trwałego aluminium, co ułatwia przenoszenie i transport urządzenia. Aluminiowe drabiny mogą być używane zarówno wewnątrz, jak i na zewnątrz budynków. Ta aluminiowa drabina wielofunkcyjna jest doskonałym wyborem dla profesjonalistów i hobbystów.  Wiele zastosowań, drabina 3-elementowa Lekka, aluminiowa drabina wielofunkcyjna Bayersystem składa się z 3 elementów, dzięki którym urządzenie może pełnić więcej niż jedną funkcję:  - drabina rozstawna, czyli konstrukcja z dwoma parami ramion, które mogą stać samodzielnie, bez konieczności opierania ich o ścianę. Wyróżnia ją stabilność i uniwersalność. Są często wybierane podczas drobnych napraw, prac remontowych oraz porządkowych. Kształtem przypomina literę ""A"". Drabina TG-DW to model wysokiej jakości ze stopniami z dwóch stron. Drabina rozstawna ma mechanizm, umożliwiający łatwe i bezpieczne składanie i rozkładanie. Kolejnym istotnym elementem jest zabezpieczenie rozstawu, które zapobiega nadmiernemu rozsuwaniu się drabiny w trakcie prac.  - drabina przystawna, czyli drabina klasyczna. Jej konstrukcja składa się z dwóch elementów: podłużnic i szczebli. Podłużnice to pionowe części drabiny, w których mocowane są poziome szczeble. Na takim stelażu opiera się cały ciężar. Aby użyć takiej drabiny, należy ją oprzeć, np. o ścianę lub regał domowej biblioteki. Drabina przystawna umożliwia dostanie się do trudno dostępnych miejsc, jak dach budynku.  - drabina wolnostojąca powstaje dzięki rozsuwanemu elementowi. Ostatni element trzyczęściowej drabiny można użytkować osobno. Odłączenie elementu od pełnej konstrukcji pozwala uzyskać dodatkową drabinę, którą charakteryzuje lekkość, nieduży rozmiar i trwałość. Natomiast jako drabina wolnostojąca wysuwna sprawdzi się w pomieszczeniu z wysokimi sufitami, do których ciężko sięgnąć.    Atutem drabiny jest możliwość wyboru rozstawienia. Wykonanie z trwałego aluminium zapewnia możliwość korzystania z urządzenia przez lata. Przy jej pomocy można przeprowadzać małe i duże prace na określonej wysokości. Ta 3 elementowa drabina pozwalana na podejmowanie prac naprawczych, remontowych i konserwacyjnych. Dzięki niej można pracować na znacznie wyższych wysokościach niż mogą to zaoferować tradycyjne drabiny dwuelementowe. Maksymalna wysokość robocza, jaką można osiągnąć podczas pracy, wykonywanej na drabinie Bayersystem 3 x 7 to ok. 4,7 m.  Bezpieczeństwo i stabilność Korzystanie z drabiny wielofunkcyjnej TG-DW 3 x 7 szczebli marki Bayersystem jest bezpieczne. Wyposażono ją w system blokujący oraz hak, który zabezpiecza zsunięcie się elementu wysuwanego. Stabilne ustawienie drabiny zapewniają stopki antypoślizgowe, znajdujące się u podstawy podłużnic. Stopki ograniczają możliwość przypadkowego rozsunięcia się drabiny. Bezpieczną pracę na wysokości umożliwiają stopnie o antypoślizgowej powierzchni.  Dla hobbystów i profesjonalistów Drabina przemysłowa Bayersystem to narzędzie profesjonalne. Spełnia normę EN 131, co stanowi o sprzęcie bezpiecznym w użytkowaniu i zgodnym z przepisami. To wielofunkcyjne narzędzie o szerokim zastosowaniu jest doskonałym wyborem dla firm i osób prywatnych. Ten model wyróżnia najwyższa jakość wykonania, gwarantując wysoki poziom bezpieczeństwa podczas użytkowania na wysokości. Każdy moduł jest wyposażony w siedem stopni o nośności 150 kg. Po zakończeniu pracy drabinę Bayersystem można łatwo i szybko złożyć, co ułatwia transport oraz przechowywanie. Długość transportowa wynosi ok. 1,9 m."|materialy budowlane
https://images.obi.pl/product/PL/836x732/512911_1.jpg|Bayersystem Drabina wielofunkcyjna TG-DW 3 x 9 szczebli|599.0|1|21|2.47|47.0|17.0|12.0|"Drabina wielofunkcyjna TG-DW 3 x 9 szczebli marki Bayersystem wyróżnia się wielością zastosowań. Jest wykonana z trwałego aluminium, które wpływa na wytrzymałość oraz odporność na uszkodzenia. Ponadto aluminium jest materiałem lekkim, dzięki czemu drabinę łatwo przestawić lub przetransportować. Aluminiowe drabiny mogą być używane zarówno wewnątrz, jak i na zewnątrz budynków.  Do profesjonalnego użytku przemysłowego Drabina przemysłowa Bayersystem to narzędzie profesjonalne. Spełnia normę EN 131, co stanowi o sprzęcie bezpiecznym w użytkowaniu i zgodnym z przepisami. Norma ta reguluje dopuszczenie urządzenia do użytku w przedsiębiorstwach oraz środowiskach pracy. Z drabiny o szerokim zastosowaniu mogą również korzystać osoby prywatne. Ten model wyróżnia najwyższa jakość wykonania, gwarantując wysoki poziom bezpieczeństwa. Drabina, na której można osiągnąć 6,01 m wysokości roboczej sprawdzi się podczas prac ogrodowych lub elewacyjnych.  Bezpieczeństwo i stabilność Korzystanie z drabiny wielofunkcyjnej TG-DW 3 x 9 szczebli marki Bayersystem jest bezpieczne. Wyposażono ją w system blokujący oraz hak, który zabezpiecza zsunięcie się elementu wysuwanego. Stabilne ustawienie drabiny zapewniają stopki antypoślizgowe, znajdujące się u podstawy podłużnic. Stopki ograniczają możliwość przypadkowego rozsunięcia się drabiny. Bezpieczną pracę na wysokości umożliwiają stopnie o antypoślizgowej powierzchni. Każdy moduł jest wyposażony w stopnie o nośności 150 kg. Po zakończeniu pracy drabinę Bayersystem można łatwo i szybko złożyć, co ułatwia transport oraz przechowywanie. Długość transportowa wynosi ok. 2,4 m.    Trzyelementowa konstrukcja - trzy sposoby użytkowania Wielofunkcyjna aluminiowa drabina przemysłowa Bayersystem składa się z 3 elementów, które umożliwiają wykorzystywanie urządzenia na kilka sposobów:  - drabina rozstawna, czyli konstrukcja z dwoma parami ramion, które mogą stać samodzielnie, bez konieczności opierania ich o ścianę. Wyróżnia ją stabilność i uniwersalność. Są często wybierane podczas drobnych napraw, prac remontowych oraz porządkowych. Kształtem przypomina literę ""A"". Drabina TG-DW to model wysokiej jakości ze stopniami z dwóch stron. Drabina rozstawna ma mechanizm, umożliwiający łatwe i bezpieczne składanie i rozkładanie. Kolejnym istotnym elementem jest zabezpieczenie rozstawu, które zapobiega nadmiernemu rozsuwaniu się drabiny w trakcie prac.  - drabina przystawna, czyli drabina klasyczna. Jej konstrukcja składa się z dwóch elementów: podłużnic i szczebli. Podłużnice to pionowe części drabiny, w których mocowane są poziome szczeble. Na takim stelażu opiera się cały ciężar. Aby użyć takiej drabiny, należy ją oprzeć, np. o ścianę. Drabina przystawna umożliwia dostanie się do trudno dostępnych miejsc, jak dach budynku.  - drabina wolnostojąca dwuelementowa i drabina jednoelementowa przystawna powstają dzięki rozsuwanemu elementowi. Ostatni element trzyczęściowej drabiny można użytkować osobno. Odłączenie elementu od pełnej konstrukcji pozwala uzyskać dwie drabiny. Dodatkowa drabina jednoelementowa jest drabiną przystawną, którą charakteryzuje lekkość i nieduży rozmiar. Drabina dwuelementowa jest wolnostojąca.  Atutem drabiny jest możliwość wyboru rozstawienia. Wykonanie z trwałego aluminium zapewnia możliwość korzystania z urządzenia przez lata. Przy jej pomocy można przeprowadzać wiele różnych prac w firmach budowlanych, przeprowadzkowych czy usługowych.Dzięki niej można pracować na znacznie wyższych wysokościach niż mogą to zaoferować tradycyjne drabiny dwuelementowe. Maksymalna wysokość robocza, jaką można osiągnąć podczas pracy, wykonywanej na drabini"|materialy budowlane
https://images.obi.pl/product/PL/836x732/307949_1.jpg|Skiva Taczka spawana 90L|229.0|1|45|63.0|60.0|93.0|16.0|Taczka spawana Skiva SV-T1. Grubość kosza: 1,0 mm Pojemność: 90l Materiał: stal Waga: 17 kg Koło : pompowane na łożysku|materialy budowlane
https://images.obi.pl/product/PL/836x732/285635_2.jpg,https://images.obi.pl/product/PL/836x732/285635_3.jpg|KRAUSE Drabina wielofunkcyjna 3x7 CORDA|499.0|1|8|16.0|45.0|196.0|15.0||materialy budowlane
https://images.obi.pl/product/PL/836x732/472741_1.jpg|CMI Pianka montażowa wężykowa 750 ml|17.98|1|70|35.5|6.5|6.5|696|Pianka montażowa, marki CMI. Jest to jednokomponentowa piana poliuretanowa w wersji z aplikatorem wężykowym do montażu, uszczelniania i wygłuszania. Charakteryzuje się dużą wytrzymałością mechaniczną i doskonałą przyczepnością do typowych materiałów konstrukcyjnych takich jak: cegła, beton, tynk, drewno, szkło, metale, styropian, twarde PCV i sztywne piany PUR.|materialy budowlane
https://images.obi.pl/product/PL/836x732/618892_1.jpg|Bayersystem Drabina przystawna TG-DJ 1 x 10 szczebli|229.0|1|40|7.0|35.0|2.67|4.00|Drabina przemysłowa TG-DJ 1 x 10 szczebli, firmy Bayersystem. Lekka, aluminiowa, jednoczęściowa drabina przystawna do wszechstronnych zastosowań. Posiada profilowane szczeble, zapewniające bezpieczne wchodzenie i schodzenie. Dolne końce podłużnic wyposażone są w antypoślizgowe stopki, gwarantujące pewne ustawienie. Maksymalne obciążenie: 150 kg. Gwarancja producenta: 2 lata.|materialy budowlane
https://images.obi.pl/product/PL/836x732/136965_1.jpg,https://images.obi.pl/product/PL/836x732/136965_2.jpg|LUX Plandeka 80 g/m2 zielona 2 m x 3 m|13.99|1|94|39.0|62.0|2.0|593|Plandeka zielona 80 g/m2. Plandeka budowlana świetnie nada się do przykrywania oraz zabezpieczania powierzchni oraz różnego rodzaju przedmiotów. Została wykonana z polietylenu, dzięki czemu jest niezwykle trwała i zachowuje swoją funkcjonalność przez długi okres użytkowania. Wymiary: 2 m x 3 m. Posiada metalowe oczka do mocowania. Chroni powierzchnię oraz przedmioty w trakcie prac budowlanych oraz malarskich.|materialy budowlane
