id|img|name|price|vat|amount|height|width|depth|weight|describe|cat
1|https://images.obi.pl/product/PL/932x365/642226_1.jpg|Einhell Akumulator 18 V PXC 5,2 Ah|259.0|1|58|16.5|8.2|8.2||Akumulator z serii Power X-Change firmy Einhell to zaawansowana technologia zapewnia zwiększoną wydajność: jeszcze większą wydajność, jeszcze większą wytrzymałość, co oszczędza czas i pieniądze. System baterii może być używany do wszystkich urządzeń z serii Power X-Change.|elektronarzedzia
2|https://images.obi.pl/product/PL/932x365/692315_1.jpg|Ryobi Akumulator RB18L50, 5Ah|399.0|1|37|15.0|5.0|8.5|840|Ryobi Akumulator RB18L50, 5Ah  Akumulator Lithium+ 5,0 Ah marki Ryobi należy do bogatej rodziny narzędzi akumulatorowych w systemie Lithium+ przeznaczonych do domu i ogrodu. W porównaniu do poprzednich generacji akumulator RB18L40 oferuje znacznie wyższą moc, zdecydowanie dłuższy czas pracy i większą trwałość. Wytrzymała konstrukcja zapewnia ochronę przed uszkodzeniem i długi okres użytkowania. Akumulator posiada 4-stopniowy wskaźnik naładowania, informujący o pozostałej do wykorzystania rezerwie energii (100%, 75%, 50%, 255), ponadto nowoczesna technologia IntelliCell monitoruje i balansuje poszczególne ogniwa, które wydłużajają czas pracy akumulatora, przechowywania i zwiekszająca jego bezpieczeństwo. Akumulator umożliwia wkręcenie do 15500 wkrętów o wymiarach 4x32mm (w tym celu należy oddzielnie dokupić wiertarko-wkrętarkę R18DD3).  Brak ładowarki w zestawie.  Specyfikacja techniczna  Napięcie/Moc: 18V Pojemność akumulatora 5,0 Ah|elektronarzedzia
3|https://images.obi.pl/product/PL/932x365/674614_1.jpg|4Garden Akumulator 20V 4Ah|159.0|1|44|7.0|75.0|12.5|650|4Garden Akumulator 20V 4Ah|elektronarzedzia
4|https://images.obi.pl/product/PL/932x365/641509_1.jpg,https://images.obi.pl/product/PL/932x365/641509_2.jpg,https://assets.obi.de/skin/a94dcb7/images/blind.gif|LUX-Tools Akumulator 20V 2Ah|119.0|1|16|||||LUX-Tools Akumulator 20V 2Ah Lekki akumulator litowo-jonowy LUX-Tools o napięciu akumulatora 20V, pojemności akumulatora 2Ah i czasie ładowania do 60 minut (za pomocą standardowej ładowarki). Akumulator posiada 4-stopniowy wyświetlacz LED informujący o poziomie naładowania. Zewnętrzna częśc akumulatora została częściowo pokryta gumową powierzchnią umożliwiającą lepszą przyczepność urządzenia, np. do powierzchni stołu warsztatowego, ułatwiając tym samym pracę. Bezpieczeństwo w użytkowaniu akumulatora zapewnia wskaźnik przegrzania. Akumulator przeznaczony do narzędzi z serii LUX-Tools.    Specyfikacja techniczna  Napięcie akumulatora: 20V Pojemność akumulatorowa: 2 Ah Rodzaj akumulatora: litowo-jonowy Czas ładowania: do 60 minut  Technologia litowo-jonowa Nowoczesny akumulator litowo-jonowy jest znacznie lżejszy i mniejszy, a także posiada wyjątkowo płaską konstrukcję. Ponadto wyróżnia się długą żywotnością i niskim samorozładowaniem, dzięki czemu akumulator sprawny jest nawet po dłuższych przerwach w pracy.  Power System PowerSystem LUX-Tools to linia produktów zasilanych akumulatorami tego samego typu. Dzięki takiemu rozwiązaniu istnieje możliwość dowolnej konfiguracji zestawu produktów i doboru optymalnej ilości potrzebnych akumulatorów.|elektronarzedzia
5|https://images.obi.pl/product/PL/932x365/673598_1.jpg|Einhell Akumulator Power X-Change 18V 2,5 Ah|139.0|1|97|17.8|6.0|8.4|495|Akumulator z serii Power X-Change firmy Einhell to zaawansowana technologia zapewnia zwiększoną wydajność: jeszcze większą wydajność, jeszcze większą wytrzymałość, co oszczędza czas i pieniądze. System baterii może być używany do wszystkich urządzeń z serii Power X-Change.|elektronarzedzia
6|https://images.obi.pl/product/PL/932x365/660865_1.jpg|Zestaw startowy 2,5 Ah|99.98|1|51||||900|ZESTAW STARTOWY 18V 2,5 Ah/ŁADOWARKA marki Einhell należy do bogatej rodziny narzędzi akumulatorowych w systemie Power X-Change przeznaczonych do domu i ogrodu. Zestaw składa się z akumulatora 2,5 Ah oraz szybkiej ładowarki. Dzięki unikalnej konstrukcji jego wymiary oraz waga są stosunkowo małe. Wyróżnia go nie tylko bardzo wysokiej jakości ogniwa litowo-jonowe, ale również zastosowana elektronika sterująca systemem ABS, który zapobiega m.in. przeładowaniu, przegrzaniu oraz samoczynnemu rozładowywaniu się akumulatora. System ten pozwala również naładować akumulator w bardzo krótkim czasie. Ładowarka zadba o to, żeby akumulator nie został przegrzany podczas ładowania i był ładowany odpowiednim napięciem i natężeniem prądu. Poinformuje nas o ewentualnym uszkodzeniu akumulatora, a kiedy zostanie głęboko rozładowany - spróbuje go pobudzić i przywrócić do normalnego funkcjonowania. System akumulatorowy Power Exchange to ponad 75 urządzeń pracujących na jednym typie akumulatora. Posiadając akumulator można dokupić pozostałe urządzenia w wersji SOLO - bez akumulatora i ładowarki. Dodatkowo istnieje możliwość dokupienia akumulatorów o różnej pojemności (od 2 Ah do 5,2Ah) i różnych typów ładowarek.|elektronarzedzia
7|https://images.obi.pl/product/PL/932x365/674128_1.jpg|Einhell Akumulator 18V 2,5Ah|139.0|1|66|17.8|6.0|8.4|457|Akumulator z serii Power X-Change firmy Einhell to zaawansowana technologia zapewnia zwiększoną wydajność: jeszcze większą wydajność, jeszcze większą wytrzymałość, co oszczędza czas i pieniądze. System baterii może być używany do wszystkich urządzeń z serii Power X-Change.|elektronarzedzia
8|https://images.obi.pl/product/PL/932x365/698893_1.jpg,https://images.obi.pl/product/PL/932x365/698893_2.jpg|Stanley FatMax Akumulator litowo-jonowy V20 2,0Ah 18V|179.0|1|47|5.5|12.8|9.0|300|Akumulator V20 Li-Ion 2,0Ah 18V marki Stanley FatMax  Dzięki ulepszonej technologii akumulatorów, braku efektu pamięci i minimalnemu samorozładowaniu, akumulator litowo-jonowy V20 jest gotowy do pracy, gdziekolwiek jesteś i dokądkolwiek zaprowadzi Cię praca - i będzie Ci służyć dłużej.  Zintegrowany wskaźnik umożliwia wygodne monitorowanie poziomu naładowania akumulatora.  Część nowego systemu akumulatorowego 18V STANLEY FATMAX V20 - zasilaj wszystkie narzędzia V20 wspólnym, nowym i ulepszonym akumulatorem litowo-jonowym 18V, który pozwoli Ci z łatwością wykonać pracę.|elektronarzedzia
9|https://images.obi.pl/product/PL/932x365/698894_1.jpg,https://images.obi.pl/product/PL/932x365/698894_2.jpg,https://assets.obi.de/skin/a94dcb7/images/blind.gif|Stanley FatMax Akumulator litowo-jonowy V20 4,0Ah 18V|279.0|1|95|7.8|12.5|9.0|500|Akumulator V20 Li-Ion 4,0Ah 18V marki Stanley FatMax  Dzięki ulepszonej technologii akumulatorów, braku efektu pamięci i minimalnemu samorozładowaniu, akumulator litowo-jonowy V20 jest gotowy do pracy, gdziekolwiek jesteś i dokądkolwiek zaprowadzi Cię praca - i będzie Ci służyć dłużej.  Zintegrowany wskaźnik umożliwia wygodne monitorowanie poziomu naładowania akumulatora.  Część nowego systemu akumulatorowego 18V STANLEY FATMAX V20 - zasilaj wszystkie narzędzia V20 wspólnym, nowym i ulepszonym akumulatorem litowo-jonowym 18V, który pozwoli Ci z łatwością wykonać pracę.|elektronarzedzia
10|https://images.obi.pl/product/PL/932x365/700943_1.jpg|Makita Akumulator Li-Ion BL1840B 4,0 Ah|379.0|1|84|6.2|7.5|11.3|640|Akumulator Li-Ion BL1840B 4,0 Ah marki Makita  Akumulator litowo-jonowy o pojemności 4,0 Ah ze wskaźnikiem naładowania.  Jest to akumulator ogólnego zastosowania o wysokiej mocy do narzędzi współpracujących z akumulatorem Makita LXT o napięciu 18 V. Doskonale sprawdza się w przypadku narzędzi o przeciętnym poborze mocy.  Przy zastosowaniu szybkiej ładowarki czas ładowania wynosi ok. 36 minut.|elektronarzedzia
11|https://images.obi.pl/product/PL/932x365/671042_1.jpg|Bosch Akumulator 18V Li 4Ah|349.0|1|38|10.1|8.4|11.8|639|Akumulator 18V o pojemności 4 Ah do elektrourządzeń z linii Power for ALL marki Bosch.|elektronarzedzia
12|https://images.obi.pl/product/PL/932x365/672925_1.jpg|Bosch Professional Akumulator GBA 18V 4Ah|349.0|1|21|5.6|11.5|7.4|684|Akumulator marki Bosch Professional dzięki niskiej wadze gwarantuje jeszcze wyższy komfort pracy. Kompatybilny ze wszystkimi narzędziami - jeden akumulator do wszystkich narzędzi danej klasy napięcia. Wyjątkowa wytrzymałość: urządzenie zachowuje pełną sprawność i funkcjonalność nawet do dłuższym czasie nieużywania. Zastosowana technologia Coolpack zapewnia dobre odprowadzanie ciepła na akumulatorze od wewnątrz na zewnątrz.|elektronarzedzia
13|https://images.obi.pl/product/PL/932x365/692314_1.jpg|Ryobi Akumulator RB18L40, 4Ah|379.0|1|16|14.5|6.5|16.5|720|Ryobi Akumulator RB18L40, 4Ah  Akumulator Lithium+ 4,0 Ah marki Ryobi należy do bogatej rodziny narzędzi akumulatorowych w systemie Lithium+ przeznaczonych do domu i ogrodu. W porównaniu do poprzednich generacji akumulator RB18L40 oferuje znacznie wyższą moc, zdecydowanie dłuższy czas pracy i większą trwałość. Wytrzymała konstrukcja zapewnia ochronę przed uszkodzeniem i długi okres użytkowania. Akumulator posiada 4-stopniowy wskaźnik naładowania, informujący o pozostałej do wykorzystania rezerwie energii (100%, 75%, 50%, 255), ponadto nowoczesna technologia IntelliCell monitoruje i balansuje poszczególne ogniwa, które wydłużajają czas pracy akumulatora, przechowywania i zwiekszająca jego bezpieczeństwo. Akumulator umożliwia wkręcenie do 1240 wkrętów o wymiarach 4x32mm (w tym celu należy oddzielnie dokupić wiertarko-wkrętarkę R18DD3) oraz 749 wkrętów o wymiarach 4x40mm (w tym celu należy oddzielnie dokupić wiertarko-wkrętarkę RCD1802)  Brak ładowarki w zestawie.  Specyfikacja techniczna  Napięcie/Moc: 18V Pojemność akumulatora 4,0 Ah|elektronarzedzia
14|https://images.obi.pl/product/PL/932x365/700942_1.jpg|Makita Akumulator Li-Ion BL1820B 2,0 Ah|279.0|1|89|4.5|7.5|11.3|380|Akumulator Li-Ion BL1820B 2,0 Ah marki Makita  Akumulator Li-ion o pojemności 2,0 Ah, wyposażony we wskaźnik naładowania. Jest to wydajny akumulator ogólnego zastosowania przeznaczony do narzędzi Makita 18V LXT .  Czas ładowania wynosi w przybliżeniu 24 minuty przy użyciu szybkiej ładowarki.|elektronarzedzia
15|https://images.obi.pl/product/PL/932x365/265399_1.jpg|Bosch akumulator GBA 18 V 2,0 Ah|259.0|1|9|||||Bosch akumulator GBA 18 V 2,0 Ah Lekki akumulator litowo-jonowy Bosch z obudową COOLPACK o napięciu akumulatora 18V, pojemności akumulatora 2Ah i czasie ładowania do 60 minut (dla baterii 2Ah). Akumulator przeznaczony jest do zasilania narzędzi akumulatorowych 18V z serii Bosch Professional (linia niebieska).    Specyfikacja techniczna  Model: GBA 18V 2Ah Napięcie akumulatora: 18V Pojemność akumulatorowa: 2 Ah Rodzaj akumulatora: litowo-jonowy Czas ładowania: do 60 minut dla baterii 2Ah  Electronic Cell Protection System CEP zapewnia urządzeniu długą żywotność i dłuższy czas pracy akumulatora. System ten chroni akumulator przed przeciążeniem, przegrzaniem, a także całkowitym rozładowaniem.  Obudowa COOLPACK Specjalna obudowa akumulatora odprowadzająca ciepło, a także regulowana prędkość pracy wentylatora w ładowarkach sieciowych Bosch zapewniają optymalną ochronę ogniw przed przegrzaniem.  Wslaźnik stanu naładowania Akumulator GBA 18V posiada wbudowany diodowy wskaźnik stanu naładowania akumulatora, który informuje użytkownika o aktualnym stanie naładowania i pozostałym do wykorzystania zapasie energii.  Świecenie 3 diod wskazuje, że akumulator naładowany jest do 100% Świecenie 2 diod wskazuje, że akumulator naładowany jest do 60% Świecenie 1 diody wskazuje, że akumulator naładowany jest do 30% Migająca dioda wskazuje, że akumulator naładowany jest poniżej 5%.|elektronarzedzia
16|https://images.obi.pl/product/PL/932x365/323418_1.jpg,https://images.obi.pl/product/PL/932x365/323418_2.jpg|Einhell Akumulator PXC 18 V 2,0 Ah|104.8|1|81|16.1|5.7|8.2|410|Akumulator PXC 18 V 2,0 Ah marki Einhell należy do bogatej rodziny narzędzi akumulatorowych w systemie Power X-Change przeznaczonych do domu i ogrodu. Dzięki unikalnej konstrukcji, jego wymiary oraz waga są stosunkowo małe. Wyróżniają go nie tylko bardzo wysokiej jakości ogniwa litowo-jonowe, ale również zastosowana elektronika sterująca systemem ABS, który zapobiega m.in. przeładowaniu, przegrzaniu oraz samoczynnemu rozładowywaniu się akumulatora. System ten pozwala również naładować akumulator w bardzo krótkim czasie.  System akumulatorowy Power Exchange to ponad 75 urządzeń pracujących na jednym typie akumulatora. Posiadając akumulator można dokupić pozostałe urządzenia w wersji SOLO - bez akumulatora i ładowarki. Dodatkowo istnieje możliwość dokupienia akumulatorów o różnej pojemności (od 2 Ah do 5,2 Ah) i różnych typów ładowarek.  Urządzenie dostarczane jest bez ładowarki.|elektronarzedzia
17|https://images.obi.pl/product/PL/932x365/674613_1.jpg|4Garden Akumulator 20V 2Ah|99.99|1|78|5.0|75.0|12.0|390|4Garden Akumulator 20V 2Ah|elektronarzedzia
18|https://images.obi.pl/product/PL/932x365/671041_1.jpg|Bosch Akumulator 18V Li 2,5Ah|239.0|1|45|9.5|15.2|15.8|365|Akumulator 18V o pojemności 2,5 Ah do elektrourządzeń z linii Power for ALL marki Bosch.|elektronarzedzia
19|https://images.obi.pl/product/PL/932x365/672924_1.jpg|Bosch Professional Zestaw startowy GBA 18V 2Ah/GBA 18V 4Ah/GAL 18V-40|699.0|1|36|7.0|21.0|8.0|1.00|Zestaw startowy - akumulatory 18V 2 i 4 Ah i ładowarka marki Bosch Professional.  Zestaw należy do bogatej rodziny narzędzi akumulatorowych marki Bosch przeznaczonych do domu i ogrodu. Dzięki unikalnej konstrukcji, wymiary oraz waga akumulatora są stosunkowo małe. Wyróżniają go nie tylko bardzo wysokiej jakości ogniwa litowo-jonowe, ale również zastosowana elektronika sterująca.|elektronarzedzia
20|https://images.obi.pl/product/PL/932x365/692313_1.jpg,https://images.obi.pl/product/PL/932x365/692313_2.jpg,https://assets.obi.de/skin/a94dcb7/images/blind.gif|Ryobi Akumulator RB18L20, 2Ah|229.0|1|20|12.6|6.8|17.2|431|Ryobi Akumulator RB18L20, 2Ah  Akumulator Lithium+ 2,0 Ah marki Ryobi należy do bogatej rodziny narzędzi akumulatorowych w systemie Lithium+ przeznaczonych do domu i ogrodu. W porównaniu do poprzednich generacji akumulator RB18L20 oferuje znacznie wyższą moc, zdecydowanie dłuższy czas pracy i większą trwałość. Wytrzymała konstrukcja zapewnia ochronę przed uszkodzeniem i długi okres użytkowania. Akumulator umożliwia wkręcenie do 600 wkrętów o wymiarach 4x32mm (w tym celu należy oddzielnie dokupić wiertarko-wkrętarkę R18DD3) oraz wykonanie do 70 cięć w drewnie sosnowym 2x6' (50x150mm) - w tym celu należy oddzielnie dokupić pilarkę tarczową R18CS.  Brak ładowarki w zestawie.  Specyfikacja techniczna  Napięcie/Moc: 18V Pojemność akumulatora 2,0 Ah|elektronarzedzia
21|https://images.obi.pl/product/PL/932x365/698895_1.jpg|Stanley FatMax Akumulator litowo-jonowy V20 6,0Ah 18V|379.0|1|90|16.5|19.5|9.5|700|Akumulator V20 Li-Ion 6,0Ah 18V marki Stanley FatMax  Dzięki ulepszonej technologii akumulatorów, braku efektu pamięci i minimalnemu samorozładowaniu, akumulator litowo-jonowy V20 jest gotowy do pracy, gdziekolwiek jesteś i dokądkolwiek zaprowadzi Cię praca - i będzie Ci służyć dłużej.  Zintegrowany wskaźnik umożliwia wygodne monitorowanie poziomu naładowania akumulatora.  Część nowego systemu akumulatorowego 18V STANLEY FATMAX V20 - zasilaj wszystkie narzędzia V20 wspólnym, nowym i ulepszonym akumulatorem litowo-jonowym 18V, który pozwoli Ci z łatwością wykonać pracę.|elektronarzedzia
22|https://images.obi.pl/product/PL/932x365/265398_1.jpg,https://images.obi.pl/product/PL/932x365/265398_2.jpg|Bosch akumulator GBA 12V 2Ah|199.0|1|72|||||Bosch akumulator GBA 12V 2Ah Lekki akumulator litowo-jonowy Bosch o napięciu akumulatora 12V, pojemności akumulatora 2Ah i czasie ładowania dla ładowarki: GAL 1230 CV - ok. 45 minut, GAL 12V-40 - ok. 30 minut, GAL 1130 CV - ok. 45 minut. Akumulator przeznaczony jest do zasilania narzędzi akumulatorowych 10,8V i 12V z serii Bosch Professional (linia niebieska).  WAŻNA INFORMACJA - zmiana z 10,8V na 12V Od stycznia 2017 roku kompletny asortyment produktów Bosch Professional 10,8V zmienił nazwę na 12V. Narzędzia 12V są nadal w pełni kompatybilne ze wszystkimi aktualnymi (10,8V) i przyszłymi (12V) elektronarzędziami, akumulatorami i ładowarkami Bosch Professional.    Specyfikacja techniczna  Model: GBA 12V Napięcie akumulatora: 12V Pojemność akumulatorowa: 2 Ah Rodzaj akumulatora: litowo-jonowy Czas ładowania: 30-45 minut  Electronic Cell Protection System CEP zapewnia urządzeniu długą żywotność i dłuższy czas pracy akumulatora. System ten chroni akumulator przed przeciążeniem, przegrzaniem, a także całkowitym rozładowaniem.|elektronarzedzia
23|https://images.obi.pl/product/PL/932x365/674127_1.jpg|Einhell Zestaw startowy - akumulator 4,0 Ah + ładowarka|199.0|1|71|17.3|8.7|18.2|1.03|Zestaw startowy - akumulator 18V 4 Ah i szybka ładowarka marki Einhell.  Zestaw należy do bogatej rodziny narzędzi akumulatorowych w systemie Power X-Change przeznaczonych do domu i ogrodu. Dzięki unikalnej konstrukcji, wymiary oraz waga akumulatora są stosunkowo małe. Wyróżniają go nie tylko bardzo wysokiej jakości ogniwa litowo-jonowe, ale również zastosowana elektronika sterująca systemem ABS, który zapobiega m.in. przeładowaniu, przegrzaniu oraz samoczynnemu rozładowywaniu się akumulatora. System ten pozwala również naładować akumulator w bardzo krótkim czasie. Ładowarka zadba o to, żeby akumulator nie został przegrzany podczas ładowania i był ładowany odpowiednim napięciem i natężeniem prądu. Poinformuje nas o ewentualnym uszkodzeniu akumulatora, a kiedy zostanie głęboko rozładowany - spróbuje go pobudzić i przywrócić do normalnego funkcjonowania.  System akumulatorowy Power X-Change to ponad 75 urządzeń pracujących na jednym typie akumulatora. Posiadając akumulator można dokupić pozostałe urządzenia w wersji SOLO - bez akumulatora i ładowarki. Dodatkowo istnieje możliwość dokupienia akumulatorów o różnej pojemności (od 2 Ah do 5,2 Ah) i różnych typów ładowarek.|elektronarzedzia
24|https://images.obi.pl/product/PL/932x365/695042_1.jpg|Bosch Professional Zestaw startowy akumulator + ładowarka 18V|399.0|1|58|9.0|18.0|22.0|1.25|Zestaw startowy marki Bosch złożony z akumulatora litowo-jonowego o pojemności 4,0 Ah oraz ładowarki. Przeznaczony do stosowania z elektronarzędziami marki Bosch.  Ładowarka może być stosowana w pozycji stojącej lub wiszącej - montaż na ścianie.|elektronarzedzia
25|https://images.obi.pl/product/PL/932x365/659480_1.jpg|Einhell Zestaw startowy - akumulator 18V 2,5Ah i ładowarka|169.0|1|19|13.9|16.5|8.5|820|Zestaw startowy - akumulator 18V 2,5 Ah i szybka ładowarka 3A marki Einhell.  Zestaw należy do bogatej rodziny narzędzi akumulatorowych w systemie Power X-Change przeznaczonych do domu i ogrodu. Dzięki unikalnej konstrukcji, wymiary oraz waga akumulatora są stosunkowo małe. Wyróżniają go nie tylko bardzo wysokiej jakości ogniwa litowo-jonowe, ale również zastosowana elektronika sterująca systemem ABS, który zapobiega m.in. przeładowaniu, przegrzaniu oraz samoczynnemu rozładowywaniu się akumulatora. System ten pozwala również naładować akumulator w bardzo krótkim czasie. Ładowarka zadba o to, żeby akumulator nie został przegrzany podczas ładowania i był ładowany odpowiednim napięciem i natężeniem prądu. Poinformuje nas o ewentualnym uszkodzeniu akumulatora, a kiedy zostanie głęboko rozładowany - spróbuje go pobudzić i przywrócić do normalnego funkcjonowania.  System akumulatorowy Power X-Change to ponad 75 urządzeń pracujących na jednym typie akumulatora. Posiadając akumulator można dokupić pozostałe urządzenia w wersji SOLO - bez akumulatora i ładowarki. Dodatkowo istnieje możliwość dokupienia akumulatorów o różnej pojemności (od 2 Ah do 5,2 Ah) i różnych typów ładowarek.|elektronarzedzia
26|https://images.obi.pl/product/PL/932x365/677518_1.jpg|Einhell Zestaw startowy - akumulator 18V 4,0 Ah i ładowarka|219.0|1|55|17.3|8.7|18.2|1.03|Zestaw startowy akumulator 18V 4,0 Ah o wymiarach 17 x 87 x 18 cm, firmy Einhell.  Zestaw należy do bogatej rodziny narzędzi akumulatorowych w systemie Power X-Change przeznaczonych do domu i ogrodu. Dzięki unikalnej konstrukcji, wymiary oraz waga akumulatora są stosunkowo małe. Wyróżniają go nie tylko bardzo wysokiej jakości ogniwa litowo-jonowe, ale również zastosowana elektronika sterująca systemem ABS, który zapobiega m.in. przeładowaniu, przegrzaniu oraz samoczynnemu rozładowywaniu się akumulatora. System ten pozwala również naładować akumulator w bardzo krótkim czasie. Ładowarka zadba o to, żeby akumulator nie został przegrzany podczas ładowania i był ładowany odpowiednim napięciem i natężeniem prądu. Poinformuje nas o ewentualnym uszkodzeniu akumulatora, a kiedy zostanie głęboko rozładowany - spróbuje go pobudzić i przywrócić do normalnego funkcjonowania.  System akumulatorowy Power X-Change to ponad 75 urządzeń pracujących na jednym typie akumulatora. Posiadając akumulator można dokupić pozostałe urządzenia w wersji SOLO - bez akumulatora i ładowarki. Dodatkowo istnieje możliwość dokupienia akumulatorów o różnej pojemności (od 2 Ah do 5,2 Ah) i różnych typów ładowarek.|elektronarzedzia
27|https://images.obi.pl/product/PL/932x365/674617_1.jpg|4Garden Szybka ładowarka 20V 2,9A|79.99|1|99|8.0|15.0|15.5|400|4Garden Szybka ładowarka 20V 2,9A|elektronarzedzia
28|https://images.obi.pl/product/PL/932x365/641509_2.jpg,https://images.obi.pl/product/PL/932x365/641509_1.jpg,https://assets.obi.de/skin/a94dcb7/images/blind.gif,https://assets.obi.de/skin/a94dcb7/images/blind.gif,https://assets.obi.de/skin/a94dcb7/images/blind.gif|LUX-Tools Zestaw startowy - akumulator 20V 2Ah + ładowarka|169.0|1|68|8.0|18.0|19.0|900|Akumulator wykonany w technologii Litowo-Jonowej o pojemności 2 Ah i napięciu maksymalnym 20 V. Akumulator przy użyciu standardowej ładowarki jest ładowany w 100% w 60 minut. Akumulator jest przeznaczony do elektrycznych urządzeń ogrodniczych marki LUX-Tools. W zestawie znajdziesz ładowarkę o mocy znamionowej - 70 W, napięciu ładowania - 20,9 V, prądzie ładowania - 2,4 V i klasie ochrony - II.|elektronarzedzia
29|https://images.obi.pl/product/PL/932x365/692317_1.jpg,https://images.obi.pl/product/PL/932x365/692317_2.jpg,https://assets.obi.de/skin/a94dcb7/images/blind.gif|Ryobi Ładowarka RC18120|159.0|1|81|10.8|6.7|20.5|604|Ryobi Ładowarka RC18120  Kompaktowa ładowarka należy do systemu Ryobi ONE+ składającego się z ponad 150 bezprzewodowych narzędzi do domu, ogrodu i wielu innych jest idealna do szybkiego ładowania baterii litowych Ryobi. Ładowarka akumulatorów litowych jest w stanie ładować z szybkością 2,0 amperów na godzinę, co oznacza, że możesz naładować akumulator o pojemności 2,0 Ah w ciągu 1 godziny. Wyposażony w lampki kontrolne, które pokazują stan naładowania i konserwacji akumulatorów. Wskaźnik gotowości do pracy pokazuje, kiedy bateria osiągnęła 80% pojemności. Zawiera inteligentne monitorowanie stanu, które ocenia napięcie i temperaturę akumulatora, zapewniając jednocześnie długotrwałą trwałość. Ładowarka kompatybilna jest ze wszystkimi akumulatorami litowo-jonowymi systemu ONE+ 18V  Specyfikacja techniczna  Napięcie/Moc: 18V Czas ładowania baterii 2Ah: 60 minut Czas ładowania baterii 3Ah: 90 minut Czas ładowania baterii 4Ah: 120 minut Szybkie ładowanie: tak|elektronarzedzia
30|https://images.obi.pl/product/PL/932x365/698917_1.jpg,https://images.obi.pl/product/PL/932x365/698917_2.jpg|Stanley FatMax Zestaw V20 akumulator 2,0Ah x 2 z ładowarką 2A 18V|379.0|1|35|34.0|33.9|10.8|1.20|Zestaw startowy z bateriami i ładowarką STANLEY FATMAX V20 2x 2.0Ah  Dzięki ulepszonej technologii akumulatorów, braku efektu pamięci i minimalnemu samorozładowaniu, akumulator litowo-jonowy V20 jest gotowy do pracy w każdym miejscu i o każdej porze - i będzie działał dłużej.  Wbudowany wskaźnik umożliwia wygodne monitorowanie poziomu naładowania akumulatora.  Ładowanie akumulatorów 18V STANLEY FATMAX V20 2,0Ah w 30 minut. Część nowego systemu akumulatorowego 18V STANLEY FATMAX V20 - zasilaj wszystkie narzędzia V20 wspólnym, nowym i ulepszonym akumulatorem litowo-jonowym, który pozwoli Ci z łatwością wykonywać pracę.|elektronarzedzia
31|https://images.obi.pl/product/PL/932x365/700989_1.jpg|Makita Ładowarka do akumulatora DC18SD Li-Ion|199.0|1|21|8.8|18.3|15.1|780|Ładowarka do akumulatora DC18SD Li-Ion marki Makita  Ładowarka z kontrolką przeznaczona do akumulatorów litowo-jonowych Makita 14,4V i 18V.|elektronarzedzia
